{
  "$schema": "./tool-mapping.schema.json",
  "schema_version": "1.0.0",
  "source_of_truth": "src/tools/*.ts server.tool registrations",
  "proposed_everyday_routes": [
    "cognitive_agent_bootstrap",
    "memory_prime",
    "memory_find",
    "memory_read",
    "memory_write",
    "epistemic_inspect",
    "epistemic_admit",
    "epistemic_append_receipt",
    "cognitive_event_append",
    "cognitive_event_read"
  ],
  "workflow_routes": {
    "orient": ["cognitive_agent_bootstrap", "memory_prime"],
    "find-and-inspect": ["memory_find", "memory_read", "epistemic_inspect", "cognitive_event_read"],
    "record-and-revise": ["memory_write", "epistemic_admit", "cognitive_event_append"],
    "review-and-learn": ["epistemic_inspect", "epistemic_append_receipt", "cognitive_event_append", "cognitive_event_read"]
  },
  "tools": [
    {
      "name": "cognitive_agent_bootstrap", "source": "src/tools/cognitive.ts",
      "input_schema": { "required": ["query", "project_id"], "optional": ["limit", "include_global", "category", "layer", "canonical_ids", "include_canonical_content", "include_excluded_details", "task_state"] },
      "scope": "Pattern 1: exact project; optional requested project plus _global; task-state sources remain separately bounded",
      "return_type": "json", "side_effects": [], "classification": "everyday", "destination": "cognitive_agent_bootstrap",
      "fallback": "cognitive_current_guidance_diagnose, then a direct bounded source read", "practice_callers": ["session orientation", "current-guidance retrieval", "task-state recovery"]
    },
    {
      "name": "memory_prime", "source": "src/tools/memory-orient.ts",
      "input_schema": { "required": [], "optional": ["project", "max_tokens", "include_archived"] },
      "scope": "omitted project returns _global; supplied project auto-includes _global",
      "return_type": "text-json", "side_effects": [], "classification": "everyday", "destination": "memory_prime",
      "fallback": "agent profile uses cognitive_agent_bootstrap when memory_prime is unavailable", "practice_callers": ["session start in agent profile"]
    },
    {
      "name": "memory_search", "source": "src/tools/memory-search.ts",
      "input_schema": { "required": ["query"], "optional": ["project_id", "category", "layer", "status", "limit"] },
      "scope": "Pattern 3: database-wide when omitted; supplied project auto-includes _global",
      "return_type": "rows", "side_effects": [], "classification": "everyday", "destination": "memory_find:search", "fallback": "full profile memory_search",
      "practice_callers": ["specific lookup", "search-before-create", "bootstrap unavailable fallback"]
    },
    {
      "name": "memory_recent", "source": "src/tools/memory-search.ts",
      "input_schema": { "required": [], "optional": ["project_id", "category", "layer", "lifecycle", "limit"] },
      "scope": "Pattern 3: database-wide when omitted; supplied project auto-includes _global",
      "return_type": "rows", "side_effects": [], "classification": "everyday", "destination": "memory_find:recent", "fallback": "memory_find:search with a freshness constraint when supported",
      "practice_callers": ["recent-state lookup"]
    },
    {
      "name": "memory_changes", "source": "src/tools/memory-search.ts",
      "input_schema": { "required": ["since"], "optional": ["project_id", "limit"] },
      "scope": "Pattern 3: database-wide when omitted; supplied project auto-includes _global",
      "return_type": "rows", "side_effects": [], "classification": "everyday", "destination": "memory_find:changes", "fallback": "memory_find:recent",
      "practice_callers": ["incremental session update"]
    },
    {
      "name": "memory_activate", "source": "src/tools/memory-graph.ts",
      "input_schema": { "required": ["query"], "optional": ["max_hop_depth", "min_synapse_weight", "limit_cap", "land_on_layers", "pass_through_layers", "project_id"] },
      "scope": "Pattern 3 anchors; graph expansion can cross project boundaries",
      "return_type": "rows",
      "side_effects": ["increments access counters and timestamps for returned memories", "increments neighborhood synapse access counters"],
      "classification": "everyday", "destination": "memory_find:related",
      "fallback": "memory_find:search", "practice_callers": ["broad related context after governing pass"]
    },
    {
      "name": "memory_get", "source": "src/tools/memory-search.ts",
      "input_schema": { "required": ["id"], "optional": ["include_synapses"] },
      "scope": "unscoped direct ID; optional neighbors are also unscoped",
      "return_type": "text-json",
      "side_effects": ["increments memory and connected-synapse access counters"],
      "classification": "everyday", "destination": "memory_read:get",
      "fallback": "full profile memory_get after explicit scope verification",
      "practice_callers": ["direct source verification", "canonical readback"]
    },
    {
      "name": "memory_synapse_traverse", "source": "src/tools/memory-graph.ts",
      "input_schema": { "required": ["id"], "optional": ["direction", "connection_type", "min_weight", "limit"] },
      "scope": "unscoped one-hop traversal; foreign-project neighbors can be hydrated",
      "return_type": "rows", "side_effects": [], "classification": "everyday", "destination": "memory_read:links",
      "fallback": "full profile traversal with explicit scope inspection; agent profile returns foreign wikilinks as reference stubs until deliberate hydration",
      "practice_callers": ["bounded related-source inspection"]
    },
    {
      "name": "memory_add", "source": "src/tools/memory-write.ts",
      "input_schema": { "required": ["category", "title", "content"], "optional": ["layer", "project_id", "summary", "tags", "lifecycle", "confidence", "importance_score", "session_id", "source"] },
      "scope": "project_id defaults to _global in legacy route; agent profile requires explicit project_id",
      "return_type": "text-json",
      "side_effects": ["inserts memory and tags", "creates wikilink and BM25 synapses", "may prune auto-links"],
      "classification": "everyday", "destination": "memory_write:add",
      "fallback": "full profile memory_add with deliberate project_id",
      "practice_callers": ["memory admission after search-before-create"]
    },
    {
      "name": "memory_update", "source": "src/tools/memory-write.ts",
      "input_schema": { "required": ["id"], "optional": ["title", "content", "summary", "tags", "category", "project_id", "layer", "lifecycle", "confidence", "importance_score"] },
      "scope": "unscoped direct ID; agent profile requires explicit project_id and precondition",
      "return_type": "text-json",
      "side_effects": ["updates memory", "replaces tags when supplied", "rebuilds wikilinks and auto-links for title/content changes"],
      "classification": "everyday", "destination": "memory_write:update",
      "fallback": "full profile memory_update after direct verification",
      "practice_callers": ["canonical-node update", "tracker update"]
    },
    {
      "name": "memory_mark", "source": "src/tools/memory-write.ts",
      "input_schema": { "required": ["id", "status"], "optional": ["reason"] },
      "scope": "unscoped direct ID; agent profile requires explicit project_id",
      "return_type": "text-json",
      "side_effects": ["changes memory status"], "classification": "everyday", "destination": "memory_write:mark",
      "fallback": "full profile memory_mark after direct verification",
      "practice_callers": ["archive or invalidate state"]
    },
    {
      "name": "memory_supersede", "source": "src/tools/memory-write.ts",
      "input_schema": { "required": ["old_id", "new_id"], "optional": ["reason"] },
      "scope": "agent profile requires explicit project_id and endpoint checks",
      "return_type": "text-json",
      "side_effects": ["atomically marks old record superseded", "creates supersedes synapse"],
      "classification": "everyday", "destination": "memory_write:supersede",
      "fallback": "full profile memory_supersede after verifying both endpoints",
      "practice_callers": ["decision reversal", "record replacement"]
    },
    {
      "name": "memory_tag_add", "source": "src/tools/memory-tags.ts",
      "input_schema": { "required": ["id", "tag"], "optional": [] },
      "scope": "agent profile requires explicit project_id",
      "return_type": "text-json", "side_effects": ["adds tag idempotently"],
      "classification": "everyday", "destination": "memory_write:tag_add",
      "fallback": "full profile memory_tag_add after direct verification",
      "practice_callers": ["tag curation"]
    },
    {
      "name": "memory_tag_remove", "source": "src/tools/memory-tags.ts",
      "input_schema": { "required": ["id", "tag"], "optional": [] },
      "scope": "agent profile requires explicit project_id",
      "return_type": "text-json", "side_effects": ["removes tag idempotently"],
      "classification": "everyday", "destination": "memory_write:tag_remove",
      "fallback": "full profile memory_tag_remove after direct verification",
      "practice_callers": ["tag curation"]
    },
    {
      "name": "epistemic_get", "source": "src/tools/epistemic.ts",
      "input_schema": { "required": ["record_id", "project_id"], "optional": ["include_global", "as_of"] },
      "scope": "Pattern 1 after scope-isolation correction: exact project; optional global-scope records",
      "return_type": "json", "side_effects": [], "classification": "everyday", "destination": "epistemic_inspect:get",
      "fallback": "full profile epistemic_get", "practice_callers": ["epistemic source verification", "as-of inspection"]
    },
    {
      "name": "epistemic_query", "source": "src/tools/epistemic.ts",
      "input_schema": { "required": ["project_id"], "optional": ["include_global", "scope", "epistemic_status", "limit"] },